{
    "$schema": "http://json-schema.org/draft-07/schema#",
    "$id": "https://adobe.io/schemas/aio/connectors/0-0-1",
    "title": "connector-schema",
    "description": "A schema for the Adobe Connector",
    "type": "object",
    "properties": {
        "name": {
          "type": "string",
          "description": "The unique connector name"
        },
        "author": {
          "type": "string",
          "description": "The name of the author"
        },
        "version": {
          "type": "string",
          "description": "The version of the connector"
        },
        "description": {
          "type": "string",
          "description": "A description of the connector"
        },
        "variables": {
          "type": ["object", "null"],
          "description": "The list of variables for source"
        },
        "provider": {
          "type": "object",
          "description": "The connector source"
        },
        "files": {
          "type": ["array", "null"],
          "items": {
            "type": "object",
            "properties": {
              "path": {
                "type": "string"
              },
              "content": {
                "type": "string"
              }
            }
          }
        }
    },
    "required":["name", "author", "version", "description", "provider"],
    "additionalProperties" : false
  }
