{
  "name": "CommerceCoreGraph",
  "version": "0.0.2",    
  "author": "nrkapoor",
  "description": "Adobe Commerce Core",
  "provider": {
    "name": "CommerceCoreGraph",
    "handler": {
      "graphql": {
        "endpoint": "${ENDPOINT_URL}"
      }
    },
    "transforms": [
      {
        "filterSchema": {
          "mode": "bare",
          "filters": [
            "Query.!category",
            "Query.!customerOrders",
            "Query.!urlResolver",
            "Query.!wishlist",
            "Query.!categoryList",
            "Mutation.!setPaymentMethodAndPlaceOrder",
            "Mutation.!addBundleProductsToCart",
            "Mutation.!addConfigurableProductsToCart",
            "Mutation.!addDownloadableProductsToCart",
            "Mutation.!addSimpleProductsToCart",
            "Mutation.!addVirtualProductsToCart",
            "Mutation.!createCustomer",
            "Mutation.!updateCustomer"
          ]
        }
      }
    ]
  }
}